{
  "schemaVersion": 1,
  "evidenceId": "r7.staging.evidence.anonymous.20260802.1",
  "mode": "anonymous-offline-evidence-only",
  "bindings": {
    "candidateVersion": "r7.candidate.20260802.1",
    "candidateCanonicalDigest": "sha256:6f1c952ba5030a46e6cf437d740991e5a5eb99cae337cab6db2d1fcf77636a8c",
    "stagingConfigurationSemanticDigest": "sha256:3873731e2d84a85dde4685da9625fe2e4ed072f41c0de8973fa5c94e7e8cec93",
    "routeIds": [
      "route:expedition-05-resource-loop:draft-1",
      "route:1-5-basic-asw-three-battle:draft-1"
    ]
  },
  "publicEvidence": {
    "dataVersion": "r7.synthetic.evidence.1",
    "publishedAt": "2026-08-02T00:00:00.000Z",
    "manifestSha256": "sha256:9f0629ec4257d8f35b16d975360a5035207bfac4028acf637d8eab9acae3c7d9",
    "questKnowledgeSha256": "sha256:40c90c3b03c90f121f55d1203ac50e3aa5cb068053faf7f5ee8217647edb9c56",
    "publicKeySha256": "sha256:40ccbd6fe4490fba63d5b9222615492e664a300a409094d7de8971b00988e246",
    "fileCount": 1,
    "payloadBytes": 32,
    "routeCount": 2,
    "requiredCheckCount": 10,
    "redactedAcceptanceStatus": "not-executed"
  },
  "roleSeparation": {
    "releaseAuthor": "actor:synthetic-external-release-author",
    "evidenceReviewer": "actor:synthetic-independent-evidence-reviewer",
    "stagingOperator": "actor:synthetic-staging-acceptance-operator"
  },
  "endpointRepresentation": "reserved-invalid-placeholder-only",
  "authorization": {
    "offlineOnly": true,
    "keyMaterialPresent": false,
    "realFingerprintPresent": false,
    "realEndpointPresent": false,
    "stagingAcceptanceAuthorized": false,
    "runtimePublicationAuthorized": false,
    "defaultEnabled": false,
    "runtimeEligibleCount": 0
  },
  "prohibitedFields": [
    "privateKey",
    "passphrase",
    "credential",
    "token",
    "publicKeyBytes",
    "manifestUrl",
    "localPath",
    "accountData",
    "personalIdentifier",
    "rawLog",
    "screenshot"
  ]
}
